{
  "id": "world-010",
  "version": "0.1.0",
  "description": "Pristine seed state. Required assertions must fail before a successful org run.",
  "state": {
    "design": {},
    "services": {
      "waitlist": {
        "status": "down"
      }
    },
    "repo": {
      "frontend": {}
    }
  }
}
