{
  "id": "world-007",
  "version": "0.1.0",
  "description": "Pristine seed state. Required assertions must fail before a successful org run.",
  "state": {
    "findings": {},
    "campaigns": {
      "EXP-88": {
        "status": "draft",
        "claim": "12%"
      }
    },
    "product_updates": {
      "EXP-88": {
        "status": "draft"
      }
    }
  }
}
