{
  "id": "world-013",
  "version": "0.1.0",
  "description": "Pristine seed state. Required assertions must fail before a successful org run.",
  "state": {
    "campaigns": {
      "atlas": {
        "status": "draft",
        "spend_committed": 0
      }
    },
    "approvals": {
      "atlas_spend": {
        "status": "none"
      }
    }
  }
}
